deptDe;fullDeptDe;deptFr;fullDeptFr;deptEn;fullDeptEn;deptIt;fullDeptItEFD;Eidgenössisches Finanzdepartement;DFF;Département fédéral des finances;FDF;Federal Departement of Finance;DFF;Dipartimento federale delle finanzeEDA;Eidgenössisches Departement für auswärtige Angelegenheiten;DFAE;Département fédéral des affaires étrangères;FDFA;Federal Department of Foreign Affairs;DFAE;Dipartimento federale degli affari esteriUVEK;Eidgenössische Departement für Umwelt, Verkehr, Energie und Kommunikation;DETEC;Département fédéral de l'environnement, des transports, de l'énergie et de la communication;DETEC;Federal Department of the Environment, Transport, Energy and Communications;DATEC;Dipartimento federale dell'ambiente, dei trasporti, dell'energia e delle comunicazioniVBS;Departement für Verteidigung, Bevölkerungsschutz und Sport;DDPS;Département fédéral de la défense, de la protection de la population et des sports;DDPS;Federal Department of Defence, Civil Protection and Sport;DDPS;Dipartimento federale della difesa, della protezione della popolazione e dello sportBK;Schweizerische Bundeskanzlei;CF;Chancellerie fédérale;FC;Federal Chancellery;CF;Cancelleria federaleEDI;Eidgenössisches Departement des Innern;DFI;Département fédéral de l'intérieur;FDHA;Federal Department of Home Affairs;DFI;Dipartimento federale dell'internoEJPD;Eidgenössisches Justiz- und Polizeidepartement;DFJP;Département fédéral de justice et police;FDJP;Federal Department of Justice and Police;DFGP;Dipartimento federale di giustizia e poliziaWBF;Eidgenössische Departement für Wirtschaft, Bildung und Forschung;DEFR;Département fédéral de l'économie, de la formation et de la recherche;EAER;Federal Department of Economic Affairs, Education and Research;DEFR;Dipartimento federale dell’economia, della formazione e della ricerca